{
  "artifact_status": "candidate_unapproved",
  "fixture_mode": "SYNTHETIC_DEMO",
  "claim_ceiling": "Shape-only screening fixture; no legal classification, licensing determination, destination authorization, vendor verification, or actual engineering performance claim.",
  "root": "kestrel",
  "rule_pack_sha": null,
  "nodes": [
    {
      "id": "kestrel",
      "kind": "product",
      "parent": null,
      "role": "structure",
      "mpn": "SYN-KESTREL-001",
      "vendor": "Synthetic Fixture Works",
      "origin": null,
      "value_usd": null,
      "part_class": "airframe",
      "attrs": {
        "endurance_h": {"value": 2.5, "unit": "h", "source_url": null, "quote": "Synthetic scenario value; D2 is not approved.", "span": null, "doc_sha256": null, "extracted_by": "human"}
      },
      "items": [],
      "declared": {"bvlos": true},
      "provenance": {"level": "synthetic", "source_ref": null}
    },
    {
      "id": "airframe",
      "kind": "assembly",
      "parent": "kestrel",
      "role": "structure",
      "mpn": "SYN-AIRFRAME-001",
      "vendor": "Synthetic Fixture Works",
      "origin": null,
      "value_usd": null,
      "part_class": "airframe",
      "attrs": {},
      "items": [],
      "declared": {},
      "provenance": {"level": "synthetic", "source_ref": null}
    },
    {
      "id": "wing",
      "kind": "part",
      "parent": "airframe",
      "role": "structure",
      "mpn": "SYN-WING-001",
      "vendor": "Synthetic Fixture Works",
      "origin": null,
      "value_usd": null,
      "part_class": "airframe",
      "attrs": {},
      "items": [],
      "declared": {},
      "provenance": {"level": "synthetic", "source_ref": null}
    },
    {
      "id": "propulsion",
      "kind": "assembly",
      "parent": "kestrel",
      "role": "power",
      "mpn": "SYN-PROPULSION-001",
      "vendor": "Synthetic Fixture Works",
      "origin": null,
      "value_usd": null,
      "part_class": "assembly",
      "attrs": {},
      "items": [],
      "declared": {},
      "provenance": {"level": "synthetic", "source_ref": null}
    },
    {
      "id": "motor",
      "kind": "part",
      "parent": "propulsion",
      "role": "power",
      "mpn": "SYN-MOTOR-001",
      "vendor": "Synthetic Fixture Works",
      "origin": null,
      "value_usd": null,
      "part_class": "motor",
      "attrs": {},
      "items": [],
      "declared": {},
      "provenance": {"level": "synthetic", "source_ref": null}
    },
    {
      "id": "prop",
      "kind": "part",
      "parent": "propulsion",
      "role": "power",
      "mpn": "SYN-PROP-001",
      "vendor": "Synthetic Fixture Works",
      "origin": null,
      "value_usd": null,
      "part_class": "prop",
      "attrs": {},
      "items": [],
      "declared": {},
      "provenance": {"level": "synthetic", "source_ref": null}
    },
    {
      "id": "avionics",
      "kind": "assembly",
      "parent": "kestrel",
      "role": "nav",
      "mpn": "SYN-AVIONICS-001",
      "vendor": "Synthetic Fixture Works",
      "origin": null,
      "value_usd": null,
      "part_class": "assembly",
      "attrs": {},
      "items": [],
      "declared": {},
      "provenance": {"level": "synthetic", "source_ref": null}
    },
    {
      "id": "fc_board",
      "kind": "part",
      "parent": "avionics",
      "role": "nav",
      "mpn": "SYN-FC-BOARD-001",
      "vendor": "Synthetic Fixture Works",
      "origin": null,
      "value_usd": null,
      "part_class": "board",
      "attrs": {},
      "items": [],
      "declared": {},
      "provenance": {"level": "synthetic", "source_ref": null}
    },
    {
      "id": "fc_mcu",
      "kind": "part",
      "parent": "fc_board",
      "role": "nav",
      "mpn": "SYN-FC-MCU-001",
      "vendor": "Synthetic Fixture Works",
      "origin": null,
      "value_usd": null,
      "part_class": "ic",
      "attrs": {},
      "items": [],
      "declared": {},
      "provenance": {"level": "synthetic", "source_ref": null}
    },
    {
      "id": "io_mcu",
      "kind": "part",
      "parent": "fc_board",
      "role": "nav",
      "mpn": "SYN-IO-MCU-001",
      "vendor": "Synthetic Fixture Works",
      "origin": null,
      "value_usd": null,
      "part_class": "ic",
      "attrs": {},
      "items": [],
      "declared": {},
      "provenance": {"level": "synthetic", "source_ref": null}
    },
    {
      "id": "imu",
      "kind": "part",
      "parent": "fc_board",
      "role": "nav",
      "mpn": "SYN-IMU-001",
      "vendor": "Synthetic Fixture Works",
      "origin": null,
      "value_usd": null,
      "part_class": "sensor",
      "attrs": {},
      "items": [],
      "declared": {},
      "provenance": {"level": "synthetic", "source_ref": null}
    },
    {
      "id": "baro",
      "kind": "part",
      "parent": "fc_board",
      "role": "sensor",
      "mpn": "SYN-BARO-001",
      "vendor": "Synthetic Fixture Works",
      "origin": null,
      "value_usd": null,
      "part_class": "sensor",
      "attrs": {},
      "items": [],
      "declared": {},
      "provenance": {"level": "synthetic", "source_ref": null}
    },
    {
      "id": "mag",
      "kind": "part",
      "parent": "fc_board",
      "role": "sensor",
      "mpn": "SYN-MAG-001",
      "vendor": "Synthetic Fixture Works",
      "origin": null,
      "value_usd": null,
      "part_class": "sensor",
      "attrs": {},
      "items": [],
      "declared": {},
      "provenance": {"level": "synthetic", "source_ref": null}
    },
    {
      "id": "gnss",
      "kind": "part",
      "parent": "fc_board",
      "role": "nav",
      "mpn": "SYN-GNSS-001",
      "vendor": "Synthetic Fixture Works",
      "origin": null,
      "value_usd": null,
      "part_class": "sensor",
      "attrs": {},
      "items": [],
      "declared": {},
      "provenance": {"level": "synthetic", "source_ref": null}
    },
    {
      "id": "battery_pack",
      "kind": "part",
      "parent": "kestrel",
      "role": "power",
      "mpn": "SYN-BATTERY-1000WH",
      "vendor": "Synthetic Fixture Works",
      "origin": null,
      "value_usd": null,
      "part_class": "battery_pack",
      "attrs": {
        "energy_Wh": {"value": 1000, "unit": "Wh", "source_url": null, "quote": "Synthetic scenario value; not vendor evidence.", "span": null, "doc_sha256": null, "extracted_by": "human"}
      },
      "items": [],
      "declared": {},
      "provenance": {"level": "synthetic", "source_ref": null}
    },
    {
      "id": "sensor_pod",
      "kind": "assembly",
      "parent": "kestrel",
      "role": "sensor",
      "mpn": "SYN-SENSOR-POD-001",
      "vendor": "Synthetic Fixture Works",
      "origin": null,
      "value_usd": null,
      "part_class": "assembly",
      "attrs": {},
      "items": [],
      "declared": {},
      "provenance": {"level": "synthetic", "source_ref": null}
    },
    {
      "id": "nose_thermal",
      "kind": "part",
      "parent": "kestrel",
      "role": "sensor",
      "mpn": "SYN-THERMAL-BASELINE",
      "vendor": "Synthetic Fixture Works",
      "origin": null,
      "value_usd": null,
      "part_class": "camera",
      "attrs": {
        "frame_rate_hz": {"value": 9, "unit": "Hz", "source_url": null, "quote": "Synthetic scenario value; not vendor evidence or a complete camera predicate.", "span": null, "doc_sha256": null, "extracted_by": "human"},
        "fpa_elements": {"value": 19200, "unit": "elements", "source_url": null, "quote": "Synthetic scenario value; not vendor evidence.", "span": null, "doc_sha256": null, "extracted_by": "human"},
        "fpa_6A002_a3_f_status": {"value": null, "unit": null, "source_url": null, "quote": "Missing; requires qualified evidence and review.", "span": null, "doc_sha256": null, "extracted_by": "human"},
        "note_3_exclusions_reviewed": {"value": false, "unit": null, "source_url": null, "quote": "Not reviewed; frame rate alone cannot establish a camera result.", "span": null, "doc_sha256": null, "extracted_by": "human"}
      },
      "items": [],
      "declared": {},
      "provenance": {"level": "synthetic", "source_ref": null}
    },
    {
      "id": "datalink",
      "kind": "part",
      "parent": "avionics",
      "role": "comms",
      "mpn": "SYN-DATALINK-001",
      "vendor": "Synthetic Fixture Works",
      "origin": null,
      "value_usd": null,
      "part_class": "radio",
      "attrs": {},
      "items": [],
      "declared": {},
      "provenance": {"level": "synthetic", "source_ref": null}
    }
  ]
}
